{
  "artifact_type": "static-contract-fixture",
  "evidence_status": "not-live-evidence",
  "proof_executed": false,
  "evidence_authenticity": "not-asserted",
  "schema_version": "floor-ratio-static-contract-fixture-v2",
  "nonce": "static-floor-ratio-20260901",
  "private_roots": {
    "status": "declared-static-path-shape-only",
    "base": "/tmp/floor-ratio-static.XXXXXX/private-static-nonce",
    "evidence": "/tmp/floor-ratio-static.XXXXXX/private-static-nonce/evidence",
    "xdg_config_home": "/tmp/floor-ratio-static.XXXXXX/private-static-nonce/xdg/config",
    "xdg_data_home": "/tmp/floor-ratio-static.XXXXXX/private-static-nonce/xdg/data",
    "xdg_runtime_dir": "/tmp/floor-ratio-static.XXXXXX/private-static-nonce/xdg/runtime",
    "wayland_socket": "/tmp/floor-ratio-static.XXXXXX/private-static-nonce/xdg/runtime/wayland-parent.sock",
    "session_bus": "/tmp/floor-ratio-static.XXXXXX/private-static-nonce/xdg/runtime/bus.sock"
  },
  "static_execution": { "proof_executed": false, "live_execution": false, "attempt_maximum": 1, "attempts_used": 0 },
  "vectors": [
    {
      "case": "single-ancestor-write",
      "fresh_decode_sequence": ["decode-before", "decode-after-ancestor-1"],
      "plans": [{ "target": "ancestor-1", "operation": "write", "value": "ratio-1-2" }],
      "writes": [{ "target": "ancestor-1", "value": "ratio-1-2", "decode_after": "decode-after-ancestor-1" }],
      "operation_trace": ["fresh-decode:baseline:current-fallback", "plan:ancestor-1", "write:ancestor-1", "fresh-decode:after-write:ancestor-1:ratio-1-2", "stop-reason:vector-complete", "cleanup:stop-child", "cleanup:restore-persistence", "cleanup:remove-private-roots", "cleanup:retain-evidence"],
      "result": "planned",
      "stop_reason": "vector-complete"
    },
    {
      "case": "multi-ancestor-writes",
      "fresh_decode_sequence": ["decode-before", "decode-after-ancestor-1", "decode-after-ancestor-2"],
      "plans": [{ "target": "ancestor-1", "operation": "write", "value": "ratio-1-2" }, { "target": "ancestor-2", "operation": "write", "value": "ratio-1-3" }],
      "writes": [{ "target": "ancestor-1", "value": "ratio-1-2", "decode_after": "decode-after-ancestor-1" }, { "target": "ancestor-2", "value": "ratio-1-3", "decode_after": "decode-after-ancestor-2" }],
      "operation_trace": ["fresh-decode:baseline:current-fallback", "plan:ancestor-1", "plan:ancestor-2", "write:ancestor-1", "fresh-decode:after-write:ancestor-1:ratio-1-2", "write:ancestor-2", "fresh-decode:after-write:ancestor-2:ratio-1-3", "stop-reason:vector-complete", "cleanup:stop-child", "cleanup:restore-persistence", "cleanup:remove-private-roots", "cleanup:retain-evidence"],
      "result": "planned",
      "stop_reason": "vector-complete"
    },
    {
      "case": "impossible-allocation-retaining-current-fallback",
      "fresh_decode_sequence": ["decode-before"],
      "plans": [{ "target": "allocation", "operation": "allocate", "value": "impossible" }],
      "writes": [],
      "operation_trace": ["fresh-decode:baseline:current-fallback", "plan:allocation", "fallback-retained:current-fallback", "stop-reason:impossible-allocation", "cleanup:stop-child", "cleanup:restore-persistence", "cleanup:remove-private-roots", "cleanup:retain-evidence"],
      "result": "fallback-retained",
      "stop_reason": "impossible-allocation"
    },
    {
      "case": "post-write-mismatch-refusal",
      "fresh_decode_sequence": ["decode-before", "decode-after-ancestor-1"],
      "plans": [{ "target": "ancestor-1", "operation": "write", "value": "ratio-candidate" }],
      "writes": [{ "target": "ancestor-1", "value": "ratio-candidate", "decode_after": "decode-after-ancestor-1" }],
      "operation_trace": ["fresh-decode:baseline:current-fallback", "plan:ancestor-1", "write:ancestor-1", "fresh-decode:after-write:ancestor-1:mismatch", "refuse:no-split-no-reverse-write", "stop-reason:post-write-mismatch", "cleanup:stop-child", "cleanup:restore-persistence", "cleanup:remove-private-roots", "cleanup:retain-evidence"],
      "result": "refused",
      "stop_reason": "post-write-mismatch"
    }
  ],
  "future_live_requirements": {
    "kwin_version": "6.7.4",
    "child_processes": 1,
    "layout": "fixed-disposable-custom-tile",
    "socket": "absolute-parent-wayland-socket",
    "xdg_isolation": "private-xdg-homes-runtime-session-bus",
    "timeout": "bounded",
    "journal_scope": "fresh-cursor-same-child-pid-project-logs",
    "persistence": "host-kwinrc-hash-mtime-before-after-private-persistence",
    "cleanup_order": ["stop-child", "restore-persistence", "remove-private-roots", "retain-evidence"],
    "command_allowlist": ["kwin_wayland", "busctl", "journalctl", "sha256sum", "stat", "timeout", "mkdir", "mktemp", "rm", "printf"],
    "vector_cases": ["single-ancestor-write", "multi-ancestor-writes", "impossible-allocation-retaining-current-fallback", "post-write-mismatch-refusal"],
    "proof_authorization": "separate-user-authorization-required",
    "dependency_capability_check": "must-be-checked-by-authorized-live-run"
  },
  "future_live_evidence_shape": {
    "status": "shape-and-requirements-only",
    "required_capture_fields": ["runtime_capture_hashes", "child_pid_identity", "child_process_count", "journal_cursor", "journal_scope", "persistence_hash_before_after", "persistence_mtime_before_after", "private_roots"],
    "authenticity_requirement": "must-be-established-by-separately-authorized-live-run"
  },
  "operation_allowlist": ["fresh-decode:baseline:current-fallback", "plan:ancestor-1", "plan:ancestor-2", "plan:allocation", "write:ancestor-1", "write:ancestor-2", "fresh-decode:after-write:ancestor-1:ratio-1-2", "fresh-decode:after-write:ancestor-1:mismatch", "fresh-decode:after-write:ancestor-2:ratio-1-3", "fallback-retained:current-fallback", "refuse:no-split-no-reverse-write", "stop-reason:vector-complete", "stop-reason:impossible-allocation", "stop-reason:post-write-mismatch", "cleanup:stop-child", "cleanup:restore-persistence", "cleanup:remove-private-roots", "cleanup:retain-evidence"],
  "cleanup_order": ["stop-child", "restore-persistence", "remove-private-roots", "retain-evidence"],
  "retention": { "evidence_on_static_failure": true, "evidence_on_interruption": true, "private_roots_removed_after_retention": true }
}
